CVE_ID,Severity,Base_Score,CVSS_Vector,Published_Date,Last_Modified,Description
CVE-2007-6036,N/A,N/A,N/A,2007-11-20,2025-04-09,"The parseRTSPRequestString function in LIVE555 Media Server 2007.11.01 and earlier allows remote attackers to cause a denial of service (daemon crash) via a short RTSP query, which causes a negative number to be used during memory allocation."
CVE-2013-6933,N/A,N/A,N/A,2014-01-23,2025-04-11,"The parseRTSPRequestString function in Live Networks Live555 Streaming Media 2011.08.13 through 2013.11.25, as used in VideoLAN VLC Media Player, allows remote attackers to cause a denial of service (crash) and possibly execute arbitrary code via a (1) space or (2) tab character at the beginning of an RTSP message, which triggers an integer underflow, infinite loop, and buffer overflow."
CVE-2013-6934,N/A,N/A,N/A,2014-01-23,2025-04-11,"The parseRTSPRequestString function in Live Networks Live555 Streaming Media 2013.11.26, as used in VideoLAN VLC Media Player, allows remote attackers to cause a denial of service (crash) and possibly execute arbitrary code via a space character at the beginning of an RTSP message, which triggers an integer underflow, infinite loop, and buffer overflow.  NOTE: this vulnerability exists because of an incomplete fix for CVE-2013-6933."
CVE-2018-4013,CRITICAL,9.8,CVSS:3.1/AV:N/AC:L/PR:N/UI:N/S:U/C:H/I:H/A:H,2018-10-19,2024-11-21,"An exploitable code execution vulnerability exists in the HTTP packet-parsing functionality of the LIVE555 RTSP server library version 0.92. A specially crafted packet can cause a stack-based buffer overflow, resulting in code execution. An attacker can send a packet to trigger this vulnerability."
CVE-2019-6256,N/A,N/A,N/A,2019-01-14,2024-11-21,"A Denial of Service issue was discovered in the LIVE555 Streaming Media libraries as used in Live555 Media Server 0.93. It can cause an RTSPServer crash in handleHTTPCmd_TunnelingPOST, when RTSP-over-HTTP tunneling is supported, via x-sessioncookie HTTP headers in a GET request and a POST request within the same TCP session. This occurs because of a call to an incorrect virtual function pointer in the readSocket function in GroupsockHelper.cpp."
CVE-2019-7314,N/A,N/A,N/A,2019-02-04,2024-11-21,"liblivemedia in Live555 before 2019.02.03 mishandles the termination of an RTSP stream after RTP/RTCP-over-RTSP has been set up, which could lead to a Use-After-Free error that causes the RTSP server to crash (Segmentation fault) or possibly have unspecified other impact."
CVE-2019-7732,N/A,N/A,N/A,2019-02-11,2024-11-21,"In Live555 0.95, a setup packet can cause a memory leak leading to DoS because, when there are multiple instances of a single field (username, realm, nonce, uri, or response), only the last instance can ever be freed."
CVE-2019-7733,N/A,N/A,N/A,2019-02-11,2024-11-21,"In Live555 0.95, there is a buffer overflow via a large integer in a Content-Length HTTP header because handleRequestBytes has an unrestricted memmove."
CVE-2019-9215,CRITICAL,9.8,CVSS:3.1/AV:N/AC:L/PR:N/UI:N/S:U/C:H/I:H/A:H,2019-02-28,2024-11-21,"In Live555 before 2019.02.27, malformed headers lead to invalid memory access in the parseAuthorizationHeader function."
CVE-2019-15232,CRITICAL,9.8,CVSS:3.1/AV:N/AC:L/PR:N/UI:N/S:U/C:H/I:H/A:H,2019-08-20,2024-11-21,"Live555 before 2019.08.16 has a Use-After-Free because GenericMediaServer::createNewClientSessionWithId can generate the same client session ID in succession, which is mishandled by the MPEG1or2 and Matroska file demultiplexors."
CVE-2021-28899,HIGH,7.5,CVSS:3.1/AV:N/AC:L/PR:N/UI:N/S:U/C:N/I:N/A:H,2021-04-29,2024-11-21,"Vulnerability in the AC3AudioFileServerMediaSubsession, ADTSAudioFileServerMediaSubsession, and AMRAudioFileServerMediaSubsessionLive OnDemandServerMediaSubsession subclasses in Networks LIVE555 Streaming Media before 2021.3.16."
CVE-2021-38380,HIGH,7.5,CVSS:3.1/AV:N/AC:L/PR:N/UI:N/S:U/C:N/I:N/A:H,2021-08-10,2024-11-21,"Live555 through 1.08 mishandles huge requests for the same MP3 stream, leading to recursion and s stack-based buffer over-read. An attacker can leverage this to launch a DoS attack."
CVE-2021-38381,MEDIUM,6.5,CVSS:3.1/AV:N/AC:L/PR:N/UI:R/S:U/C:N/I:N/A:H,2021-08-10,2024-11-21,Live555 through 1.08 does not handle MPEG-1 or 2 files properly. Sending two successive RTSP SETUP commands for the same track causes a Use-After-Free and daemon crash.
CVE-2021-38382,MEDIUM,6.5,CVSS:3.1/AV:N/AC:L/PR:N/UI:R/S:U/C:N/I:N/A:H,2021-08-10,2024-11-21,Live555 through 1.08 does not handle Matroska and Ogg files properly. Sending two successive RTSP SETUP commands for the same track causes a Use-After-Free and daemon crash.
CVE-2021-39282,HIGH,7.5,CVSS:3.1/AV:N/AC:L/PR:N/UI:N/S:U/C:N/I:N/A:H,2021-08-18,2024-11-21,Live555 through 1.08 has a memory leak in AC3AudioStreamParser for AC3 files.
CVE-2021-39283,MEDIUM,5.5,CVSS:3.1/AV:L/AC:L/PR:N/UI:R/S:U/C:N/I:N/A:H,2021-08-18,2024-11-21,liveMedia/FramedSource.cpp in Live555 through 1.08 allows an assertion failure and application exit via multiple SETUP and PLAY commands.
CVE-2021-41396,HIGH,7.5,CVSS:3.1/AV:N/AC:L/PR:N/UI:N/S:U/C:N/I:N/A:H,2022-07-12,2024-11-21,"Live555 through 1.08 does not handle socket connections properly. A huge number of incoming socket connections in a short time invokes the error-handling module, in which a heap-based buffer overflow happens. An attacker can leverage this to launch a DoS attack."
CVE-2023-37117,CRITICAL,9.8,CVSS:3.1/AV:N/AC:L/PR:N/UI:N/S:U/C:H/I:H/A:H,2024-01-12,2024-11-21,A heap-use-after-free vulnerability was found in live555 version 2023.05.10 while handling the SETUP.
CVE-2025-65404,MEDIUM,6.5,CVSS:3.1/AV:N/AC:L/PR:N/UI:R/S:U/C:N/I:N/A:H,2025-12-01,2025-12-02,A buffer overflow in the getSideInfo2() function of Live555 Streaming Media v2018.09.02 allows attackers to cause a Denial of Service (DoS) via a crafted MP3 stream.
CVE-2025-65405,MEDIUM,6.5,CVSS:3.1/AV:N/AC:L/PR:N/UI:R/S:U/C:N/I:N/A:H,2025-12-01,2025-12-02,A use-after-free in the ADTSAudioFileSource::samplingFrequency() function of Live555 Streaming Media v2018.09.02 allows attackers to cause a Denial of Service (DoS) via supplying a crafted ADTS/AAC file.
CVE-2025-65406,MEDIUM,6.5,CVSS:3.1/AV:N/AC:L/PR:N/UI:R/S:U/C:N/I:N/A:H,2025-12-01,2025-12-02,A heap overflow in the MatroskaFile::createRTPSinkForTrackNumber() function of Live555 Streaming Media v2018.09.02 allows attackers to cause a Denial of Service (DoS) via supplying a crafted MKV file.
CVE-2025-65408,MEDIUM,6.5,CVSS:3.1/AV:N/AC:L/PR:N/UI:R/S:U/C:N/I:N/A:H,2025-12-01,2025-12-02,A NULL pointer dereference in the ADTSAudioFileServerMediaSubsession::createNewRTPSink() function of Live555 Streaming Media v2018.09.02 allows attackers to cause a Denial of Service (DoS) via supplying a crafted ADTS file.
CVE-2025-65407,MEDIUM,6.5,CVSS:3.1/AV:N/AC:L/PR:N/UI:R/S:U/C:N/I:N/A:H,2025-12-01,2025-12-02,A use-after-free in the MPEG1or2Demux::newElementaryStream() function of Live555 Streaming Media v2018.09.02 allows attackers to cause a Denial of Service (DoS) via supplying a crafted MPEG Program stream.
